{
  "$schema": "https://json-schema.org/draft/2020-12/schema",
  "$id": "https://meeting-coach.local/meeting-card/v1.json",
  "title": "Meeting Card v1",
  "description": "One JSON per meeting reflection session. Captures the meeting's context (project link, purpose, attendees), the user's own intent before the coach speaks, the coach's high-level analysis (strengths, growth points, reflection questions), and the user's reasoning logged across the session. Companion to the project-card; lives in <project>/meetings/.",
  "type": "object",
  "required": [
    "schema_version",
    "id",
    "project_id",
    "title",
    "date",
    "meeting_type",
    "purpose",
    "desired_outcome",
    "attendees",
    "user_role",
    "user_intent",
    "transcript_provided",
    "analysis",
    "created_at",
    "status"
  ],
  "additionalProperties": false,
  "properties": {
    "schema_version": {
      "type": "integer",
      "const": 1,
      "description": "Meeting-card schema version. v1 is the initial version."
    },
    "id": {
      "type": "string",
      "pattern": "^MTG-[A-Z]{2,10}-[A-Z]{2,7}-\\d{4}-\\d{2}-\\d{2}-\\d{2}$",
      "description": "Format: MTG-{customer_code}-{project_code}-{YYYY-MM-DD}-{NN}. NN is a 2-digit ordinal if multiple meetings on one date in the same project; otherwise 01. The {customer_code}-{project_code} portion must match the linked project-card id."
    },
    "project_id": {
      "type": "string",
      "pattern": "^[A-Z]{2,10}-[A-Z]{2,7}$",
      "description": "Reference to the project-card id. The project-card must exist before the meeting-card is created."
    },
    "title": {
      "type": "string",
      "minLength": 3,
      "maxLength": 200,
      "description": "Short human-readable label, e.g., 'Vendor kickoff with Acme Cloud' or 'Steering group week 14'."
    },
    "date": {
      "type": "string",
      "pattern": "^\\d{4}-\\d{2}-\\d{2}$"
    },
    "duration_minutes": {
      "type": ["integer", "null"],
      "minimum": 1
    },
    "meeting_type": {
      "type": "string",
      "enum": [
        "kickoff",
        "steering",
        "sponsor-sync",
        "stakeholder-sync",
        "vendor-call",
        "1on1",
        "workshop",
        "retrospective",
        "decision",
        "escalation",
        "status",
        "other"
      ],
      "description": "Type of meeting. Drives the coach's prior on what 'good facilitation' looks like in context."
    },
    "purpose": {
      "type": "string",
      "minLength": 10,
      "description": "Why did the group come together? 1-3 sentences. Hard non-empty (mirrors project-card.purpose mechanic — prevents empty metadata)."
    },
    "desired_outcome": {
      "type": "string",
      "minLength": 5,
      "description": "What did this specific meeting need to produce or move forward? One sentence."
    },
    "attendees": {
      "type": "array",
      "minItems": 1,
      "description": "People present. When contact_id is set, the contact-card is the authoritative source; name and party here are convenience copies that may be stale.",
      "items": {
        "type": "object",
        "required": ["name"],
        "additionalProperties": false,
        "properties": {
          "contact_id": {
            "type": ["string", "null"],
            "pattern": "^CONTACT-[A-Z]{2,10}-[a-z0-9-]+$",
            "description": "Optional reference to a contact-card. If set, name/role/party here are convenience copies of the canonical record."
          },
          "name": { "type": "string" },
          "role": {
            "type": ["string", "null"],
            "description": "Role in this meeting, e.g., 'project sponsor', 'tech lead', 'vendor PM'."
          },
          "party": {
            "type": ["string", "null"],
            "enum": ["customer", "vendor", "internal", "third-party", null],
            "description": "Side at the table. Aligns with project-card stakeholders[].party vocabulary."
          }
        }
      }
    },
    "user_role": {
      "type": "string",
      "enum": ["facilitator", "co-facilitator", "participant", "observer"],
      "description": "The user's role in this meeting."
    },
    "user_intent": {
      "type": "string",
      "minLength": 10,
      "description": "What did YOU want to land in this meeting? Written by the user before the coach analyzes. The coach mirrors against this — without it, the coach has nothing to compare its read to and slips into reviewer-mode."
    },
    "user_self_assessment": {
      "type": ["string", "null"],
      "maxLength": 1000,
      "description": "Optional: the user's own pre-coach read on how the meeting went. Written before the coach speaks. Sharpens the Socratic frame — the coach can ask 'you wrote X here, where in the transcript do you see that?'"
    },
    "transcript_provided": {
      "type": "boolean",
      "description": "Whether the user pasted a transcript. False means coaching was conducted from memory or notes only — analysis confidence is lower and the coach must flag that explicitly."
    },
    "transcript_excerpt": {
      "type": ["string", "null"],
      "maxLength": 2000,
      "description": "Short excerpt for identification (NOT the full transcript). Required when transcript_provided is true — see conditional rule below."
    },
    "analysis": {
      "type": "object",
      "required": ["strengths", "growth_points", "reflection_questions"],
      "additionalProperties": false,
      "properties": {
        "strengths": {
          "type": "array",
          "minItems": 1,
          "maxItems": 5,
          "description": "Specific moments where the user facilitated well. Evidence-anchored; never generic praise.",
          "items": {
            "type": "object",
            "required": ["observation"],
            "additionalProperties": false,
            "properties": {
              "moment": {
                "type": ["string", "null"],
                "description": "Anchor: a quote, time marker, or section."
              },
              "observation": { "type": "string" },
              "skill": {
                "type": ["string", "null"],
                "description": "The facilitation skill demonstrated, e.g., 'reframing', 'silence-holding', 'inviting dissent', 'naming the elephant'."
              }
            }
          }
        },
        "growth_points": {
          "type": "array",
          "maxItems": 3,
          "description": "Moments to revisit. Coach surfaces; user reasons. Capped at 3 to force selectivity — a real coach picks the few that matter, not every imperfection. Each item ends with a reflection_prompt, NEVER a prescription.",
          "items": {
            "type": "object",
            "required": ["observation", "reflection_prompt"],
            "additionalProperties": false,
            "properties": {
              "moment": { "type": ["string", "null"] },
              "observation": { "type": "string" },
              "reflection_prompt": {
                "type": "string",
                "description": "Open question for the user to reason with. Examples: 'What do you think was happening for X at that moment?' 'If you replayed those 30 seconds, what would you want to land differently?' NEVER 'next time you should do Y'."
              }
            }
          }
        },
        "reflection_questions": {
          "type": "array",
          "minItems": 1,
          "maxItems": 5,
          "items": { "type": "string" },
          "description": "Overarching questions the coach raises about this meeting — pattern-level, not moment-level. E.g., 'Whose voice did you not hear today?' 'When you felt resistance from the sponsor, what was the assumption underneath your reply?'"
        },
        "pattern_read": {
          "type": ["string", "null"],
          "maxLength": 500,
          "description": "Optional one-paragraph high-level read on what the coach saw as the through-line of this meeting. NOT a summary of what was said (that would be minutes) — a read on the facilitation pattern."
        }
      }
    },
    "user_reflections": {
      "type": "array",
      "description": "Append-only log of what the user reasoned to after the coach's prompts. Filled during and after the session — this is the substance the user is here to grow.",
      "items": {
        "type": "object",
        "required": ["ts", "text"],
        "additionalProperties": false,
        "properties": {
          "ts": { "type": "string", "format": "date-time" },
          "text": { "type": "string" },
          "responds_to": {
            "type": ["string", "null"],
            "description": "Optional pointer to a growth_point or reflection_question this responds to (e.g., 'growth_points[1]'). Index-based; valid for the analysis as written. If the analysis is re-run and arrays reshuffle, this pointer is best-effort only — for durable longitudinal tracking, copy the original observation text into the reflection."
          }
        }
      }
    },
    "previous_meeting_card_id": {
      "type": ["string", "null"],
      "pattern": "^MTG-[A-Z]{2,10}-[A-Z]{2,7}-\\d{4}-\\d{2}-\\d{2}-\\d{2}$",
      "description": "Link to the immediately preceding meeting-card in the same project, for longitudinal tracking of recurring patterns."
    },
    "created_at": {
      "type": "string",
      "format": "date-time"
    },
    "status": {
      "type": "string",
      "enum": ["analyzed", "archived"],
      "description": "analyzed = coach produced analysis (the default state). archived = closed; no further reflection expected. Whether the user has reflected is derivable from user_reflections.length > 0 — do not encode it as a status."
    }
  },
  "allOf": [
    {
      "if": {
        "properties": { "transcript_provided": { "const": true } },
        "required": ["transcript_provided"]
      },
      "then": {
        "required": ["transcript_excerpt"],
        "properties": {
          "transcript_excerpt": { "type": "string", "minLength": 50 }
        }
      }
    }
  ]
}
